,Review
0,using app . google store giving warning app safe . 'll deleting app phone . developers shed light ? sudden dangerous app phone ? 
1,"worst app , much glitch could download videos photos , suggest please download application , working properly ðŸ‘Ž like app ðŸ˜’ðŸ‘Ž "
2,"apps lots great features useless ! keeps crashing constantly . tried various ways free space , clear cache etc . app looks good deliver . wasted money app . disappointed . "
3,app paid app never like home good use manage app please life time free version launch best service provider 
4,"nice app.i finally purchased full version .however , purchased app stopped working .it works .i really want leave poor review , tired able use paid .as student writer apps help leave .i really disgusted , make several attempts contacting app developers .and upon reciving email address reciving , told said address exist . "
5,faltu application remove play store 
6,"pro limits really ruin app . understand purpose behind `` pro `` paid features , leaving free users options really hurts first impression app delivers , say first impressions lasting impressions . uninstalling app . "
7,worse app ever downloaded . constantly gives warning google account login options . 
8,"installed , played around little , uninstalled minutes later . app hides phone express purpose making difficult possible ( impossible ) find manage shady trusted . well , exporting video , could find , spent hour searching phone , folder folder . makers app gone way make app limits , . "
9,worst app ca save picture gallery download downloaded deleted immediately 
10,downloaded app . within hours attempt hack google account made purchases attempted . dont download . 
11,log app . repeatedly tells password wrong although using password use computer . much better use website phone . 
12,"going extremely complicated registration procedure , visiting cspd activate account , found app extremely slow responsive . error messages everywhere . barely usable . please disable full screen view enable `` back `` `` home `` gestures . "
13,"needs account bugs keep development ! plus , app takes huge battery galaxy note 10 plus ? .. suppert idea ( used need ) deleted phone , cos sure keeping saved privacy information . "
14,bank app show users transaction history . nonsense 
15,"useless application , cant set common password transaction whats use , make people download first one referred another banking app ; bankðŸ˜’ðŸ˜’ "
16,"mobile app good smart , , facing challenge able view transaction history . reported issue bank told network . past one month , unable view transaction history . please fix issue . intense awkward situation issue . "
17,access bank app useless able login account moreover obvious settings displayed pls work app 
18,app log middle transaction says ... app bug free cache ... meanwhile primary aim android device bank transactions . 
19,"latest update pure rubbish , time clicked access , app automatically shut self . please look asap "
20,"worse app ever , migrating diamond app worst mistake ever , could login change device directory keep saving mobile banking profile . customer care could resolve . nonsense app ever "
21,"useless app , ever open app fingerprint stop working "
22,poor integration app banking services . understand 'll creat app wo allow login . useless 
23,installed uninstalled app several times . app wo show menu list easy access . access app transactions play store direct . bad . still privacy personal details app ? bad . 
24,wonderful app secure 
25,junk app goggle needs remove playstore 
26,app disappointment . middle transaction log . please access bank needs something app people far home access . 
27,app good needs improvement . fingerprint access login session timeout expired quickly 
28,"wasted data download app .. giving problem .. wanted register working well .. please app made compulsory , downloaded access bank first , directed access .. waste data "
29,"app refuses install phone .. need statement account urgently , guys referred mobile app . "
30,access app starting misbehaving know able open updating ia writing access stopped 
31,"access app innovative mobile payment application offers banking experience . app built help customers consummate financial transactions , payment solutions enjoy lifestyle experience . prospect customers welcome become account holders downloading app onboarding platform seamlessly . "
32,"wonder access bank would want intrude private browsing history users ? track customer browsing activities new app . user name , john otitoju , raised concern surprisingly , access bank ignored important concern . please respond concern raised assuage fears . "
33,app useless . sent message download access app ... made change password time without number ca login main access bank app . 
34,worst app ever ðŸ‘ŽðŸ½ login app suddenly profile disabled despite giving account credentials end disabling profile ridiculous . 
35,suppose provide entry space user name password accessing app allow comfortable mind users fraudsters . scared ðŸ˜¨ event since ever app ... 
36,"application save biometric , good friendly like diamond app "
37,"app sucks ! ! better put , response system sucks worse ! ages tried setup app device , ut keeps prompting user i.d exists . tried setting new i.d prompted app , rigorous steps `` successful `` badge , returns error . multiple visits bank avail . nonsense ! think support support live chat bank claims urbane tech savvy ? ridiculous ! "
38,"app worst internet banking app ever used , login fingerprint working well , cant veiw transaction history , service app poor "
39,"refuses open main usage , inputting login details 'll close automatically , developer confirm uploaded , nonesence time wasting app , download ... "
40,app badly designed . another `` innovation `` trusted smrt . customer service attitude sucks . claim system triggered breach safeguard lock account indefinitely without particular reason . points forfeited . waste time app . 
41,scam app . locks account scan enough points redeem excuse getting location data even app shows set location gps 
42,"note 20 ultra . order app open properly decline permissions ( storage , gps , mic ) . say yes allow phone access . app open got settings enable gps storage recording . done disable reopen app . "
43,please install app app fraud hack device shows notifications deleting plays music background 
44,untrusted app ! paid one month debited 2 months without consent bank account ! app shows 1 monthly payment progress . perfect 0/10 app make online payments easy . 
45,"application functioning . log ... keeps loading thus enable make payments . uninstalled apps , reintalled . asks register issue keeps loading "
46,"awful apps , even went `` fill id number `` section says need update apps ssl certificate expires went upgrade cant proceed ... really need talk developper ... "
47,use app without granting permission access files . hkma allowing banks require intrusive behaviour access basic banking services . 'll closing accounts soon . 
48,"permission required necessary , likes spyware financial app . would recommend uninstall immediately . notification digital token android 12 "
49,"app requests unnecessary access location , phone call .... camera . like spy ware . use till clear explanation . bad app security perspective view . "
50,"gmail warned app trying access sensitive information immediately blocked . taking chances .. copy-paste text , listen link bottom needs microphone permission . sure app trying .. worth time .. "
51,another garbage apt wo allow save spies collect information protect criminal apps 
52,"anther junk app device , spying . functionality garbage : nothing fancy timer . test suppose take picture test capable control zoom brightness/contrast . resulted images recognised . - > complete garbage . uninstalling . best information protection : never collect . "
53,"privacy nightmare . read end user license agreements , people ! "
54,"app asks much personal information without explaining need . let people use basic needs . ongo test kit simple use helpful , mobile app . personal information collected . "
55,app wants way many permissions personal data . 
56,"never saves login info , makes jump hoops retrieve . also , collecting required info , wo let login saying `` issue occurred , try later `` . try later several times , let log . suppose pay mortgage app wo let log ? ? ? guess 'll call every month . terrible app . "
57,use password manager generate actual secure passwords . autofilling actively disallowed app . discouraging tools result less secure passwords clients . 'll using website impose ridiculous limitations important tools . update : still terrible idea use app . use website . 
58,"app remember password , fingerprints , access code life depends . hard imagine ignorance developers mortgage company allow poor quality app . "
59,uninstall twice locks u wont let access schedule clock times . awful app . needs major improvements 
60,"happy forced set biometric security phone , delete app forced use ! ! ! ! "
61,"logging account app causes galaxy a10e close background apps , disconnects bluetooth accessories , dumps ram . addition , clock-in/clock-out feature brings original web portal . impressed . upgrade rating app improves . standing . "
62,beware ! fraudulent app . option delete account personal data . 
63,bad app install ... worst app request users please donot install 
64,"app feel safe wo let delete account . apps option delete , taking private data keeping without consent . already contacted customer service , said feature delete users account . "
65,one worst app playstore please request google ceo remove app playstore . download app 
66,google remove fraud app 
67,one fraud app request google delet app google play . download application got many messages calls chatboat subscription calls . fullish application ever . option cancelled subscription delete account opetion . 
68,"app link forgot user id password , able login account due forgot user id & password . without app login , option contact customer support , read views playstore others website app , fake mobile app . customer service bad response query . "
69,subscribed app .. restore phone apps gone . asking registration . app forget id password options . cheating app 
70,google responsible accountable entity please remove app play store loots user money play identity using accounts sending fake msgs . please something immediately . ! 
71,fraud app forgot id password anable login premium account disgusting * install able login contact customers care 
72,playstore must remove apps like thisðŸ˜’ 
73,worst app work properly want deactivate account app option think one greatest fraud app ever made 
74,app fraud type gud social networking work like thief plzzzz requested dont install 
75,worst app ever seen type apps . coustemer service respond . provide gmail working . main purpose app taking money install app . install app . time waste 
76,"subscription getting messages . thought users app fooling around , app sending messages users name . mistake made . trust similar applications "
77,found app using photos without permission instagram users . 
78,pleaee dont install mistakenly .this worst app fake id inside app wont let delete account anymore customer support app . acknowledged worst app google play 
79,app asks storage permission . denied uninstalled 
80,"wrost app word . required permission manage calls , take photo , record vedios , etc . "
81,"wants access storage , contacts phones data ... worst app "
82,way many permissions . wants control android system access personal info . shove 
83,"features nice & would used quite bit . however , app runs constantly apparent reason causes become irritated & suspicious . chose uninstall battery lifetime far important necessary app . photo editor runs continuously dozen installed . "
84,app spying app goes way beyond platform pay rent . focuses collecting personal information private internet phone calls txt mms data . alreating government officals deem fit form `` illegal activities `` crime given fact `` legal `` differs `` illegal `` 'll greatfully transfer private data . forget data worth billions . wo give info llords hold . 
85,"disabled notifications android system settings , every time open app prompted enable notifications . option within app disable notifications , stuck annoying notification every time open app . "
86,"reviewed permissions app requires ... absolutely ridiculous . strongly suggest read . permissions agree include : read private calendar event data , sms messages , `` redirect outgoing phone calls `` ... heck ? ! ? nice looking app permissions insane ... "
87,app sync online banking app . asked user apply 2fa sms .. make use secure2u feature online banking app . since app kind linked associate online banking app . time overhaul sync online banking app started using . waste time download . 
88,login 16digit credit card number every time big deterent use app . nowadays common use fingerprint easy secure access . @ jun 2019 app got worse ! cant log unable tick agree terms conditions . silly app ! 
89,app freezes second screen saying need give location permissions . completed yet frozen screen still . 
90,useless app . would accept password tried reset . also would accept temporary password emailed ... uninstalled . 
91,"broken apps , apps force close scan qrcode consumer product "
92,app sucks ! ! ! locks nearly every time login . change password 5 times one week . use fingerprint login well locks saying ca verify credentials . fix app . need view bank account . use app fix . 
93,unable use fingerprint log . kicks app completely . 
94,2 cameras one back house ( tosee ) app great stores motion clips easy see . front camera use new tosee plus app cant connect camera app using back tosee plus app garbage basically wants subscribe monthly service pay . anyone using decent app alternative ? ? 
95,app claims another app preventing usage .. ? _i enjoyed app yrs update one phones restricted warning .. 2 phones.difff carriers .. cant use either one ... ðŸ‘ŽðŸ½boo 
96,"app stuck black screen clear data shared required details . paid membership , even able use app . response developer side . "
97,"app functionality working fine , much notification sell products . thats done , breach trust . "
98,app throwing useless irritating notifications . planning uninstall . 
99,"app tracks sleep staying notification panel without user permission . breach trust privacy shows data hungry companies . got need app uninstalled . let know change policies . know turn sleep tracking , explicit user permission . "
100,signing email need permission view read messages asking phone privacy left web later stage ordering stuff phone provided . importantly try app first see useful decide keep delete . deleting app . 
101,battery drainer ! started sleep monitoring without selecting option . presumably prevent app sleeping collect data . 
102,app allow read privacy policy terms . quit app click privacy policy . idea going details . 
103,app monitors sleep even turning sleep monitoring setting app . please fix bug . keep getting notifications every night manually turn . 
104,app demands access camera phone instead allowing good quality pictures dslr . 
105,"app access/ load photos , even though explicitly gave permission . dont show . "
106,app monthly deletes saved login choices stable . 
107,"hello , downloaded app ca go next page , required accept privacy policy , filled personal details tick accept privacy policy , ask please accept privacy policy.kindly help solve issue . "
108,app working photos selected gallery deleted permanently automatically lost many documents 
109,unusable app without full functionality android users . point android version perform inspections ios device . horrible company 
110,"try collect privacy , bad apk "
111,app secretly take photos videos data theft app please remove app play store 
112,hello play store teams please remove application fud apps 
113,helo mudrakwik users please remove application phone application collection data black mailing family members friends pictures crox red circles call inform sending masage permission 
114,wrose app ... filled personal details required company email ... give show invalid email id since days ... fake app 
115,download app fraud app collecting data asking reverse pay money first plzplz use fraud app worst ... 
116,bad experience app . received notification informing rs.15000 approved upload documents . login security pin 
117,"worst app , fraud , collection money done install application "
118,"worst app , fraud , collection money done install application "
119,"fraud app , taking money name subscriptions , approving loans instead taking money us name subscription plans . finally apps robbing like . "
120,app one worst app .. pay 59 fill personal information app working .. servies fully unsupported customer ... bad .. fully bad ... dont install 
121,recommend app . wasted time telling document document finally asked pay amount using app . informed uploading documents confidential details . else mention app eligibility critertia . internal policy ? ? nothing status . charged fee use app . happened shared bank details personal data . worst app forever 
122,wrost app saved personal details paying 59rs wrost app instant loan costumer service mail 
123,fraud app . working properly . irritating users & collect users data . 
124,"fraud app , rs.50 paid , information unidentified content . complaint raised blacklist app shortly "
125,fake app stealing users info . den automatically blocking . 
126,barkar service world trust app thanks rejecting inform customers download app 
127,useless fraud app . help also helpless demands documents already uploads documents app 
128,"worst app ever downloaded ðŸ˜’ paid yearly subscription ... 149.00 cnd yet unable unlock videos . android phone keep getting message download latest version make sure wi-fi mobile data turned , .... also uninstalled installed app .. went settings allowed permissions .... know else . â˜¹ï¸ "
129,"google please close app many user bad experiences app , developer reply .. 2017 already purchased never login app .. today buy melawai store said check apps , remember click forgot password work , tried second option login google account work .. check guarantee , buy historical made "
130,app drains phone battery 
131,repeatedly sending notification pop-up installing apps . user interested show pop-up 
132,"app ask permission contact , calls media deny run . users becoming privacy concerned forced . "
133,audio recording capability app pathetic . sending voice notes good option app . reason people prefer whatsapp hike . 
134,using hike last 3 yr amazing app .... faces problems ... like hide content reading fingerprint ... needs always password ... te loading 10 message per one notification msg delete everyone 
135,"receiving messages instantly , open app receive notification , app allowed work even background , working good internet connection , kindly resolve issue "
136,requires permission contacts calling . without wo able use app . like want app allow us read contacts care whether want keep hidden us . think permission allowed disable specific functionality app . guess considered . 
137,excellent app prefer privacy . fingerprint lock / pin whole app . would perfect . hey developers almost apps support split screen option . hike still supporting . split screen new feature android . useful feature hike lacks . also another issue videos uploading . takes long send videos . could tweak app bit better user experience . 
138,issue recieving messages delayed app running background even though given full optimum permission . want also point contacts app refresh change name person system seriously major bugs highly anticipated apps nuisance words taken little seriously developers working vain . run app development company would love help . 
139,"best app , develops new extra features app "
140,"app used fantastic , recently moving app android ios device , lost chats . reported product team nearly 15days back , got response . liking . resetting account option also available new release , restore backup well . : ( "
141,government india marked app insecure ... take measures protect private data . 
142,security intrusion detection ! even though auto back turned started taking backup background ! ðŸ˜¡ðŸ˜³ 
143,hi .. deleting hike hide option contact numbers . please give us option app choose hide contact . believe popular . 
144,hate app one reason ... send sms contacts without user permission ðŸ˜•ðŸ˜•it bad thing app ... uninstall app ... 
145,worst app . .zero privacy concern ... u block someone person nd add group .... nd aftr putting compliant one consult . use things . ... privacy worst app ... want give single star even . . 
146,used great app . unnecessary updates copycat features ruining app user experience 
147,cautious ! app open allow contacts access ! 
148,great messaging app new automatic backup feature letting us search old messages reinstalled 
149,auto backup makes concern privacy ...... i.ll happy hike made end end encrypted like whatsapp ... 
150,"liked old version , hike 5.0 . awesome safe ( reliable privacy personal information ) . new version safe.you get calls random people . less chances making friends ones know . extra features existed previously . personappy recommend use app . "
151,app good getting warning system stating hike ia using mic background annoying privacy issue 
152,great app privacy good media sharing always stuck sending media also hiccups sending receiving messages 
153,"apps user information hacking , use apps "
154,"good app . prefer app chatting due richer chatting experience . issues : 1 . reply feature work links , please enable . 2 . ca view hidden chats hike web , even unlocking app . please look matter . 3 . notifications come open app , requires fixed soon possible . bring features like bringing whatsapp group chat messages hike groups , hike direct , deleting messages . "
155,privacy .. one . check messages view messages .. getting lots options invite friends hate ... getting ? .. please change features app .. wanted invite friends .. sending particular person something .. options also ? ? ? ? plzzzz change app features ... please make privacy protected .. however features like 
156,"using hike last 3 years . old hike far better new one . full bugs irritating uses . * * seen lot comments trouble sending message receiving messages , also facing untill open app seeing msg notification hike eventhough lot messages . irritating . issue loose lot users , friends already stopped using "
157,autobackup made mandatory instead optional . dont want backup media files online app way stop . app backs data online without permission . totally wrong . 
158,"new incoming messge notification received , even notification setting ok. allowed background data . "
159,great app . suggestions . provide end end encryption . increase number people join group . enable transferring files types sizes . also make sms app . provide features hike skyrocketed fame . 
160,wrost app app received picture video audio save memorycard phone memory like app 
161,"previous version ok .... 6.o good .... one problem new version stays offline open app . open app , shows 'you online get messages sent others . must give push notifications .... everything checked system settings notification . "
162,farud app taking many permissions 
163,"hike zero privacy , exploitative copycat messaging app . fooled superficial resemble telegram whatsapp , app hoards data . read privacy policy . everything put app legally property developers . worst application imaginable . using let control images text . careful . stay control data . delete account . read privacy policy terms service . "
164,harvesting email addresses . went delete app data & app wo let . 
165,updated latest version app wants update . asks permissions nothing . looks like scraping personal info .... 
166,"never seen app want many permissions . verizon need read confidential notes calendar ? modify call log ? switch flashlight ? close apps ? access fingerprint reader ? 'll pass , thanks . "
167,"latest phone update , app recognize phone allow log credentials . worthless . "
168,"app installed google bought nexus 6 , realized asking silently denied superuser access . one would app need elevated permission , two , stated apps description privacy policy ? ? calling google pull possible malicious application play store due subject . "
169,business account app give new features like safety mode new ui . also let stay logged app always makes enter username password even select `` remember `` . please fix . 
170,permissions like make apps undesirable . 
171,"huge app way many app permissions required ( dubious given poor past privacy history ) . slow lots spinning circle icon . support showing basics like current full bill itemized charges . strange ux inconsistent android ux guidelines . get review change plan really wanted , 'll immediately uninstall . "
172,"candy wrapper web app , true mobile app . requires login every single time . option save credentials . modern mobile oses provide secure way store credentials . app leverage . find typing strong password every single time entertaining . "
173,automatic virus scanner claims app threat every day since last upgrade . 
