,Review
1571,"used app couple months today open app , really need blur face photo , publishing social media , ca open album . photos , downloads , nothing . words app remove phone since non-working app . "
1572,thought found photo app less permissions folks took cake unnecessary needed access info . 
1573,"great app , another money-grab app . completely removed ability watch add feature use . idea implemented -- google play recently changed * never * update setting , surprise , surprise . uninstalling . "
1574,"fishy app , extracts lot background data . unnecessary usage data photo editor app . recommended people value privacy . "
1575,"warning ! ! app installing videos content without permission ! ! conset app instal unwanted videos , photos material . reported google play ! "
1576,app permission charge google acct $ 20.00 .. load app virus steal money acct conected phone . 
1577,seems reason people create applications days sneak phone gather data sell third parties charge reason without permission think twice downloading anything google play app matter anywhere come point google play instagram social platforms playing field thieves run wild repercussions disappointed google play something . 
1578,app drains mobile phone battery 55 % using app . 
1579,app eats free space hiding folder images app undetected outside gallery . 
1580,app started sending unwelcome notifications . way turn . uninstalled . 
1581,app good ads app able compromise airbrush . phone picture gallery loaded hundreds pictures take download . found app compromised ? simply checking details unauthorized photo gallery lead path source . deleted app another source found checking details far good . factory reset necessary . wish android would restrict rogue ads compromise good apps . 
1582,"app constantly runs background even change permissions .. next use goes right back allowing background use , constantly go back change permissions . newest version remedy obviously .. shame love app otherwise .. see people complaining thing .. please fix ! "
1583,"app installed home screen phone , unlock one mine . invasive annoying . "
1584,"new update came lock screen feature , saw android permit anymore . really annoying cant see photo editing app thing lock screen , specially without permission . least , disable easily "
1585,"constantly running background sucking battery want turned . ability choose images saved , put camera thousands others . emails answered company . interesting filters , terrible app overall . "
1586,"installed app held phone awake hour next day . force stopped app system settings , revived held phone awake yet another hour . uninstalling . "
1587,forced lock screen ask way remove . said lock screen displays apps . officially adware . 
1588,desperate app started serving ads phone lockscreen without opt 
1589,mysteriously drains battery . even use app . uninstalled . ðŸ’” 
1590,beware . privacy setting . photos stored app . 
1591,app stealing personal informations silently ... good thing uninstalled . 
1592,reason photo editing app need permission make phone calls . bye 
1593,supports apps also add new apps notifications . also support fingerprint . uninstalled . 
1594,"wish use security features built android app . pins , passwords , smart lock , etc . function well app . "
1595,easy bypass secury app restart phone ( system security disabled app recommendation ) . notification donot show echo lockscreen ex : zalo messenger . please fix issue . 
1596,good notification app . security 2 options . pin password lock missing . sometimes lockscreen disable automatically . launch app . need developement . 
1597,camera button map camera app . paid get rid ads lock screen 
1598,"reported app developer bugs privacy issue app , bother reply . privacy issue : app keeps sending data server sure lock screen app needs send data server . bug issue : 1 . wallpaper remains darkened even unchecking option `` darken wallpaper `` . 2 . shows duplicate notifications . sometimes two four . noticed bug whatsapp messages . "
1599,"lack custom security broken wallpaper setting , camera shortcut open camera save pictures taken , always screen receiving random notification lack support ( via email ) . app update fix , well - great app replace lockscreen due cleaner look . "
1600,"app default choice choosing lockscreen , last update almost drained ( small ) data plan . uninstalling ... "
1601,"used great app , shared family friends . frustrating . 1 , get 2 notifications single message , one telling message concerning one first lines message security ! 2 , get notification messages sent ! 3 , messages already opened still get listed - great security , wasting screen space & makes think could update conversation , 4 , sometimes tapping item bypasses security "
1602,"privacy option . everybody read messages lockscreen , point ? "
1603,"aesthetically amazing , notification function fantastic , security measure easily overridden simply rebooting phone , defeats entire objective app . "
1604,"receive hangout notifications , wo dismiss lockscreen even read dismissed app . forced dismiss notifications manually . please fix "
1605,camera slide shortcut lock screen require password ! ! ! ! ! even set default app ! ! ! ! ! ! ! ! ! 
1606,"promising app . one best lock screen apps tried , mostly aesthetic appearance . two huge things needs done order app get publicity lock screen security music controls . "
1607,app great theory plagued short comings every developer attempting make lock screen know implement version 1.0.0 like media controls ( music players ) working freaking volume buttons . want email mom goto priority category email facebook goto social category ? leaving app installed await updates deactivating going back lockerscreen pro2 
1608,"app prevents using banking app ( anz ) , says another app running interfering prevents using security reasons . even apps fault , need mobile banking need beautiful lock screen . issue still exists 0.8.11 "
1609,google play protect advised remove app harmful behavior . 
1610,im going suggest download app google play protect removed app phone said app download apps without permission ! 
1611,"warning ! app caught using camera background without permission . installed , deleted immediately . download ! ! ! "
1612,app whilst features good sure spy app warnings phone also prompts ad whenever connect wi-fi show connection guise ad . constantly wants connect phone contacts also . soon find replacement app 'll deleting . 
1613,privacy invasion . app detected phone using camera background . stripped permissions uninstalled app . eff ! ! ! ! 
1614,recently app kept turning mobile wifi decided removed . 
1615,"despite restricting access wifi , data background permissions , app still remains open despite closing upon receiving notification running background . uninstalling immediately would recommend others . intrusive . "
1616,app constantly runs background . fond . also permissions required use app extremely intrusive . app access read sd card ? modify delete contents sd card ? take pictures video ? record audio ? way ! uninstalled . 
1617,"wish could given negative 100 ratings , first app needs rooted mentioned directly developer ( unknown individual ) hoarding downloads read long ass article configure mapping controller app updated 2016 favor run away may distributing malware sort . "
1618,"persistent pop-up keeps asking root access . ca deny get away , ca click away . basically hijacked entire phone , leaving option giving completely unnecessary high-level permission . shady af . restart phone avoid giving permissions . fall trap . "
1619,"uninstalled . see reason give app permission access contacts list , record videos take photos . using years , longer new `` improvements `` . respect customers privacy . "
1620,application may using private content information illegally . information one today biggest asset . application ask permission making risk situation phone ? application threat information security . may every provider like days . 
1621,"app uploads images , potential privacy issue .. "
1622,"app uploading photos server , serious issue . privacy scan completes . sale everyone personal life scanning , suggest stay away app . "
1623,want take control google account ? seems fishy . google security alerted soon child used app couple minutes . uninstalled ! 
1624,"app asks accept permission access phones photos media , ability record thing , accept loading option login google account , app closes ! kept trying get app thing happend ! worried app put spyware phone anti-virus software picked anything far ! "
1625,"permanent login failures banking apps running . trading options limited , info outdated stock prices differ even one app page . "
1626,worst ecosystem experience ever ( banking app + tant2go + visa secure ) 
1627,"able login android device using fingerprint , bug app "
1628,"app usable . entering login information app shows login page asks login information . get online banking . also connect app new phone constantly keep carrying old phone around get online banking , even using website app . totally unusable . "
1629,ux terrible . biometric authentication work . initial user name needed login 12 digit number . impossible individual phone numbers verification joint account . seriously considering closing account app hassle . would wish upon worst enemy 
1630,worst banking app ever . fingerprint login supported leads error result locked account . login sometimes fail unknown reason result locked account . happens lot . way fix issue calling unreachable customer service . 
1631,"works access tracking server webtrekk . unacceptable tracking removed , fingerprint service broken . testing going live app ? "
1632,photo editing app need access microphone ? ? ? one . needs access phone contacts ? dodgy app likely listens private conversations avoid app apps need access microphone ! ! ! ! ! plus dunt click agree wo allow back click click ! ! bad ! 
1633,"5 stars transparent data shared third-party merchants , unfortunately sharing makes customers wary , suggest read apps privacy policy . uninstalled app , time say indiscriminate sharing data . "
1634,bloated app intrusive ads tracking interupt recording cancels saving . used great app . 
1635,app take away photos videos gallery including private photos think installing 
1636,forcing give microphone location permissions . privacy nightmare . 
1637,dont download application . phone got hacked today . hackers threatened . happened b612 get access folders messages . development team take matter seriously . 
1638,security gallery lock app worst 
1639,"today first time read privacy policy conditions shoking stole data apps , disgusting frustrating us please stop collect personal information allowed.just stop reason unhappy fake app . "
1640,"app reserve huge storage without files , videos , pictures . useless dangerous app device . ðŸ˜‘ðŸ˜‘ðŸ˜‘ "
1641,rude ...... app good clicked many photos delete certain app becoz space management .... remove photos deleted 
1642,b612team collecting personal database like give open read privacy policy uninstall application . 
1643,oh god much data app steal mobile please check first privacy policy download ðŸ˜“ðŸ˜“ðŸ˜¡ðŸ˜¡ yes camera result excellent app steal data information want : - ( 
1644,app breach privacy . collect info profit purpose ... apps good meant purpose photo graphy .. info personal information leak threat .. sorry ðŸ¦Š review basis privacy policy .. thank .. 
1645,worse app ever seen ... privacy issue 
1646,privacy secure hate type app collect users data 
1647,doesnot support delete apps download app 
1648,worst app . needs access microphone video recorder . spyware 
1649,read article cybernews apps would stole privacy without permission . must clear clarified secure . 
1650,download app steals personal data 
1651,loved app . found full spyware stealing data . 
1652,"need allow almost permission use app , uninstall using app . "
1653,app working slow . hated . really say normal camera better app . requesting install app justwastage time back camera takes blur pictures night app useless dark blur pictures clicked . really hated app please download 
1654,caught app using camera background without permission . 
1655,"demands access stored images , videos , control phone calls , wo let use features even need . probably app harvest info . filters need access camera try , wants force everything wo let try . "
1656,"lame app , many permissions , uninstalling "
1657,photography app needs permissions phone calls ? 
1658,"warning ! downloaded app ago never used , today got notification samsung account app recording using camera microphone 3 minutes , never opened app months . "
1659,gallery accessed app without restrictions app gets opened . 
1660,app storage option user change storage location . 
1661,photos ckicked using app gets deleted 
1662,installed working wants share personal info logged like app 
1663,bad make feel angry hated app ðŸ˜¡ðŸ˜¡ðŸ˜¡ install app app lost home screen 
1664,accidentally uninstall photos gone ðŸ™„ðŸ–• hate app 
1665,"downloading app , ask granting access microphone , camera , mobile id calls details ... less photo maker spy .... suspious activity noted highly discouraged "
1666,application uninstall mandatory data ( photos ) secondary storage uninstall beach app photos deleted app angry seen gallery photos deleted beach app please provide possible solutions backup images 
1667,"think app safe , hacks privacy . mean app need review browsing history , location , wifi connection information device id call info ? ! never install app . "
1668,"app keeps crashing ca submit paper work requested app requires many permissions need view contact read write sms emails want press charges invasion family privacy strongly suggest use app definitely support partnerships , sister companies authorize use information data collected sales marketing revoke permissions app request "
1669,"another failed tracking app . keep tracking apps simple possible . app `` always tracking `` , , brokers keep calling update app location . whole point getting tracked drivers constantly worry . phone gps , location service tracking active , yet , app pick . take carrier link app example work . "
1670,tracking apps banned . violation privacy personal phone . 
1671,terrible app . permission turned time using yet constantly ask location updates . 
1672,"slow phone . install spyware . drivers beware ! ! ! app requires tracking time , even app use ! ! ! ! app also wants access microphone camera . "
1673,"bs another app wants access phone , tracking sporadic "
1674,"bad ! bad ! bad ! becomes intrusive anoing , use good app . constantly asking every click turn extra google location sharing use extra wifi bluetooth `` better `` location determination , click `` thanks `` 20 times enough ? gps location enough whats ? ! wifi/bluetooth scanning back ground turned wifi mandatory app , option skip use gps ! hell app useing "
1675,app . hate apps require use personal phone tracked . 
1676,"like concept app , biggest pet peeve privacy violation , already pushing comfort zone app phone . biggest upset tracking automatically start without permission . "
1677,app useless unless give access location . granted permission access location using app app wants full unrestricted access anytime want pull location . 
1678,app wanting permission many things choice load hauling mandatory ... soon load uninstall app 
1679,"invasive app , need access gallery contacts information , also broker ca force anyone download tracking apps , illegal also lawsuit ; enough nsa spying need anyone else invading phone . "
1680,"shady things background . beware privacy concerns . installed app 3 months ago opened first day . saw continually sending data , using tons storage draining battery , even though gave storage permissions . seems awfully unnecessary simple face swap app . "
1681,"app constantly running background launching ads-pop-ups apps download page google play , even app closed ( makes intrusive action untraceable ) . "
1682,worst app ever ! doesnt come ! saved camera ! worst app ! download ! 
1683,"middle road , semi functional , banking app . sure disable app permissions camera , ... since requests access everything mobile device . "
1684,app accept online account credentials . 
1685,many suspicious app permissions app need make phone calls read contacts ? please disable would use .. 
1686,ðŸ˜¡ðŸ˜¡ðŸ˜¡ðŸ˜¡worst app ever . install apps side apps forcefully install mobile . aggressively approach bad . hate app management . 
1687,app shares personal information third party apps please beware app 
1688,"good app new updation guys spoiled app , messaging option , private lock videos , private account , see add request , much bugs heavy consumption data phone getting heat , 10 friends going uninstalling . app becoming big scam . "
1689,worst app ever . ca delete account . says feature yet . blatant disregard user privacy . 
1690,"app virus . interfers within meetings , webinars , calls . ban app immidiately "
1691,worst app .. trust app .. 300+ wallet deducted money without valid reason . fraud app install 
1692,app download empty storage fail want remove id without download app please give solution gmail 
1693,make app secure 
1694,good app short one rix login google hacked privacy 
1695,worst app ever salect pictures album background music salected autometically deleted moreover pics cant adjusted wish app useful hate app 
1696,worst app ever seen allowed permissions always showing allow camera permissions iam making vedio making vedio able zoom vedio always asking anable access camera permission although given permission working 
1697,app wants download contacts .. important matter me.so uninstaling app suggesting anyone install . 
1698,asking permissions access personal phone numbers saved google - required ? uninstalling- 
1699,app mandates share personal details contact list . give access entire directory . kindly allow harm cyper way . 
1700,good app privacy policy 
1701,app good .. features private account .. privacy .. needs updates 
1702,app bad install background run 24hours data leaked 
1703,much bad experience app without permission automatic . download app phone automatic open ... 
1704,app privacy .we comment plz add new privacy 
1705,"app nice system privacy like tik tok want publish video option privacy otherwise nice app , request bring option privacy "
1706,worst app privacy settings give ca delete account also 
1707,app privacy option . please provide us privacy option one main thing app consumes lot data . please look matter . 
1708,need privacy settings .... otherwise okay ... want take vdo slow sudden close app 
1709,worst app ever .. privacy sitting .not able upload videos .. time uninstall 
1710,"app nice , n like . want privacy app , app features good n mind blowing ... âœ "
1711,need privacy policy asap otherwise im uninstalling app 
1712,app needs much information & permission app may one permission & allowed contacts etc . see app plz something ...... 
1713,disappointed privacy policy . private video app . 
1714,app good please update want privacy settings 
1715,apps good privacy 
1716,privacy setting app hope future u please pay towards privacy setting particular peoples ... app gud alternate tiktok according privacy setting give 2stars ... # privacymustðŸ™ðŸ» 
1717,feature private account must added.overall good app.private account privacy missing thing making app poorly designed . 
1718,app download phone verified security longer ca install app 
1719,"apps requires contact info get login . mean , even necessary . could given password username login option . downloaded app reading reviews sadly even created account uninstall . suggestions login username password filters good effects needed rest improvement make used app . "
1720,happy app privacy options deleting options ðŸ˜ ðŸ˜ ðŸ˜¡ kind app plz dont try app 
1721,"à¤¬à¤•à¤µà¤¾à¤¸ app guys plz install lots bugs need update : - # privacy option , security option= personal public # deactivate permanent delete option # user name , , # use music option know easy use music videos # delete option # accept reject follower # intersetd non interested option good luck app surely get success ... changes must ..... "
1722,app ok privacy option everyone view video ca hide video someone worst thing dont like app 
1723,worst app ever seen entire life workingproperly plus doesnt privacy system nothing worst appp 
1724,bad app app share personal information privacy policy read please 
1725,"app great data privacy , , "
1726,beware ! ! ! registered app uploaded documents . became `` verified `` . days made 50 $ deposit test features . guess ? right got account closed document verification problems ( verification successfull deposit ) . e-mail spam folder wait 60 days get money back . seems made app get personal information hold funds . seems need lock change bank card used fishy app 
1727,"latest update , app reliable . , reset password every time want get clearance check "
1728,questionable app . reason needs permission `` make call `` 
1729,app allow update profile picture . even granted permission . 
1730,bad app app support phone requested play store app remove app fraud 
1731,fruad app steals information hacks phone please install 
1732,app requires uploading photos developer . thank . 3 stars least tell sort beginning . 
1733,"app connects easily smove pro mobile , work well new android devices like samsung s9 plus . phone connected smove , phone must really mounted device phone landscape mode . problem , menu portrait mode one juggles phone adjusting settings , stabilizer goes nuts . biggest problem sound recorded . tech suppord advised uninstall app , reboot phone reinstall making sure grant permissions asked including access sound . done multiple time without getting sound record picture . another problem includes granting access phone functions , app utilizes basically none start stop recording resolution recording . "
1734,"bit awkward clunky use . example , profile entries updated app settings must entered browser . new messages appear messages must deleted notifications . directory lists users given name rather surname , search capability . privacy violations may concern users app , makes users contact information details personal activities available . "
1735,`` malware found `` warning given . phone urged uninstall app fast ! 
1736,load google map . return home doesnt work gps pin point location . waypoint . tried install uninstall 5 times ... nothing works ... google map blank whit screen . permission location always granted .. set time ... 
1737,worst app ever used . cant even share pics documents app.they dont even visible gallery too.im exhausted using app . 
1738,comfortable app able see credit card numbers passwords 
1739,app doest accept phone permission ... solution problem .. please solution 
1740,"app reported . features advertised , ugly filters find anywhere . also seems upload photos , careful using ... "
1741,"app asked permission enable camera . nothing happens even clicking ok . , unfriendly . manage secure online transactions . "
1742,app bs read privacy policy none app want access everything phone every picture every file every email every thing phone tell whatever want information . 
1743,"ads annoying , expected guess . setting one device , uninstalling , installing another device recognized location offered setup devices * * scanning network . way possible app sent ip device info servers . never asked consent collection info , advised privacy policy , even prompted review terms . data collection nightmare serving ads . avoid ! confirmed wake lan function . "
1744,granting potentially harmful permissions google login unknown closed-source dev good idea . 
1745,"! Â¡ warning Â¡ ! app tracks devices location , matter install app stores files location file bug hacks device made hacker install app want save "
1746,app function properly location permission denied . instead still allowing user manually select positions map ( option already available ) app becomes useless . 
1747,"extremely bad app . even bother installing . signing facebook work . signing mobile number work fails send otp code . try sign google last resort , anyway ask mobile number fail send otp code . basically , way sign . collected personal information google ca even use app remove data . developers ashamed . "
1748,could activate camera gallery upload photo id selfie verification despite app given permission access camera media files 
1749,"â€¼ï¸ warning app malicious unreasonable unnecessary permissions seriously compromise privacy . download application . â€Œá€’á€±á€«á€„á€ºá€¸á€œá€¯á€•á€º á€™á€œá€¯á€•á€ºá€€á€¼á€•á€«á€”á€²á€· , á€žá€„á€·á€º privacy á€¡á€á€½á€€á€º á€¡á€›á€™á€ºá€¸á€¸ á€¡á€”á€¹á€á€›á€¬á€šá€ºá€™á€»á€¬á€¸á€•á€«á€á€šá€ºá‹ "
1750,"allow autofill password managers . asks enable fingerprint lock , allows use app without prompting fingerprint verification . "
1751,"beware useless , completely bogus , junk app . sole purpose collect users personal data info nothing claimed . total waste time ; steer clear . privacy policy hugely incomplete bogus . developers must fined imprisoned . "
