,Review
3121,app randomly decide ring alarm remind ( found slept ) ca alarm allow app run background low battery . trusted reliability app happen ps . leave phone normal full battery . reason stop working . 
3122,amazing app new privacy policy sharing everything deleted 
3123,uninstalled due wanting leave app alarm sounds . 
3124,app collecting lots unsafe personal information 
3125,alarm ring . next opening told remove battery optimization . told first opened app . 
3126,"alarmy works , great . lot features easy use . however , multiple times simply gone morning , causing late work appointments . claims missing permissions already allowed . want able give app five stars , go good without giving , 'll change review . right ca good conscience recommend . "
3127,"use app long time , still installed phone . today noticed internet data usage high . turned , alarm app used mobile data background . considering used years . uninstalled . "
3128,app auto updated blames battery saver ( turned ) alarm refusing go . 
3129,"great app enabled app tracker protection duckduck go privacy browser ( blocks trackers apps ) , duckduck blocked 695 app trackers app , thats opening app . uninstalled . "
3130,"became worst , asking internal files permission viewing photos suggest personalized ads hypocrisy , deleted app asked "
3131,"app tracks time . really mean time . every . single . minute ! send data advertisers . beware freeware . pay , product . app invades privacy . think function app alarms , yet records everything phone , including location . "
3132,"app forces phone show matter , ignores phone permissions displays top apps alarm rings . malicious , dont download . "
3133,"app good . still hate helping us , want permissions us . first 2-3 days alarm rang properly stops ranging starts ruin every morning . days show pop-up alarm * rang allow permission * . like fraud . tell earlier alarm rang without permissions ? . happened suddenly working properly starting days ? "
3134,ðŸ˜¥ app stay background even though locked allowed battery optimisations . 
3135,"trust . go often . required permissions given , run background . prevent tha battery optimization well . uninstalled . "
3136,"latest android updates , alarms go random . app given permissions , battery optimized . never activated , multiple times . disappointed understatement . "
3137,app made phone consistently start ringing alarm would stop til deleted app .... 
3138,"pop use exact geolocation personal data , soon open app . tells withdraw consent menu . . option . removed app . "
3139,"used really like app , updates keep making unusable . every weeks , something different operate app , particularly regards permissions . course , wo find something changed go turn alarm , ca fix alarmy always comes back alarm going . good app , super buggy inconsistent . going back normal alarm . "
3140,"avoid spyware . predatory behavior observed times . alarm functions worked intended , company behavior interpreted deceitful . app pushes new data sharing consent forms immediately upon waking ( looked like alarm ) confuse sign allow . understand consent needed app use , interpret behavior attempt trick users accept . "
3141,gutted app 2 years started ask permission photos vidoes identiy . bye avoid app much better one list ðŸ‘ðŸ½ 
3142,beware ! app started requiring consent scanning phone personal data giving huge list third parties . literally disagree first . tell go retract consent later menu . force close program agree give consent . definitely uninstalling finding another alarm app . bad decent alarm app forced consent data theft insane . 
3143,"alarm automatically removed recent apps , plz fix problem "
3144,"working , alarm.is notifying .. even allowing permission requited notification display apps . useless , waste memory andncannot trsut alarm make u miss important meetings "
3145,"app functions really well terms loud insistent , basically malware . tries list device administrator . ? asks access storage , alarm definitely need . phoning home kinds places , including facebook . want facebook knowing sleep habits ? [ alarm need storage , prevent uninstall , contact facebook ? need prevent uninstall ? alarm , malware detector ] "
3146,"[ phone honor 10i fairly new ] app messing life latest update ... think `` exclude battery optimization `` permission , invasive permission absolutely unnecessary . brink upgrading alramy pro remove ads awesome app thought deserved money proving otherwise breaking customers trust . fixed next update goodbye . "
3147,app worst ever used . keeps ringing even put mobile silent mode . please remove app play store . 
3148,"alarm goes app wo open , immediately deleted . good thing tested first . "
3149,"glitchy , app would open wanted turn alarm could turn alarm . restart phone finally shut continued next alarms . "
3150,app work well since latest android update . screen wo show alarm going end turn phone . makes unusable uninstalling . 
3151,privacy settings confusing configure . uninstall . app creepy . 
3152,longer functions . alarm clock currently goes without providing prompt turn . hard restart phone real quick uninstall app get stop going . maybe 'll try reinstall later ridiculous . 
3153,app installed least 2 years issues . sudden restart phone turn every morning due popup way launch app alarm going . way wake everyday . deleting . 
3154,"since pixel 2 upgrade android 10 , alarm disables phone . acts user repeatedly pushing home button . turn alarm anything . "
3155,"loud alarm , disabled turning phone , found alarm rang unable even turn ! app refused run , refused let access settings power ! really big problem "
3156,want uninstall app able people forcing put application phone . convinced highly recommend people install application may case also 
3157,"months using would turn without extended permission . would even let uninstall without . stay far away . edit : make fault , anyone see recent reviews . app would let uninstall disable alarm . always leave uninstall option case stay somewhere without photo take . broke app , stop treating everyone like user error . "
3158,new update causes alarms go phone crash time 
3159,suggestion- feaure let app know arent place photo suppossed.to take . delete app town photo kept going . 
3160,app work even adjusting permissions oppo r15 . app show multitasking/clear apps page . 
3161,"uninstalled app , shut alarm . ðŸ™„ "
3162,"last update : closed app , alarm ring . got notice might restrict alarmy fact . pls fix "
3163,app recording mms send owner . chek permission . install . 
3164,"new update android 8.0 , alarmy stopped working . playing alarms showing message caution . "
3165,"uninstalled today . would alarm supposed . would alarm sometimes supposed . morning alarm clicked app showed alarming silently , except volume phone silent . "
3166,app bit intrusive . privacy wise . 
3167,app locked permanent device asministrator removed . stay away . 
3168,"get warning `` app sharing personal information location unknown `` shame like app uninstalled , snooping people wrong . "
3169,"app used enormous amount background data ( wifi , thankfully ) without informing asking permission . idea afraid 'll move another alarm app concerned app may botnet application "
3170,app great . months ago stopped backing data ca access . prompts upgrade full version attempt access information get error message . absolutely went hill 
3171,worst app.why app require access photos medias ? 
3172,"purchased app like . helps manage many accounts . started closing unexpected error certain actions . force closes accessing party app . contacted developers still received kind reply . tried re-installing fix issue . , must purchase app use , even ended free trial period restore data . horrible service pay twice glitchy product . "
3173,dont install app ever . take data hostage take money . app unethical business model . 
3174,"spyware steals info , wo enable mic despite given permissions , optimized phones even couple years old . disappointed uninstalled . fix app ! ! ! "
3175,app amazing potential unfortunately extremely buggy shuts second time try open . also bit suspicious seems force download files background phone cant seem able stop . tried send email developer returned delivery failure since email exist ! developer bother answer complaints negative reviews . something fishy going advise everyone avoid downloading app . 
3176,install apps . 'll take personal information ! 
3177,"lookout samsung says app harmful phone involved third party forward personal information data , sms , contacts personal information . "
3178,"app spyware . thing literally send location third parties , value privacy install app "
3179,great changed permissions wanted access needed functional requirements application . # shady 
3180,warning : app shares private info installs virus device 
3181,app permission download files without notifying user . combine fact detected spyware means app removed face earth . 
3182,use lookout security app immediately flagged app contained spyware 
3183,"phone detected spyware app capable sending personal information call logs location third party . suggest getting app , value privacy . "
3184,cellphone displayed detected spyware app ! uninstalled . cautious security phone . 
3185,"regarding app-card registration failure , addressed permitting 'get device info app management . "
3186,"apps need personal information like camera , 'd location & contacts aprowel . "
3187,"permissions app -- many ! many unnecessary permissions . sneaky apps read and/or change owner confidential info make changes settings , etc . absolutely reason . none . "
3188,"rubbish money extortion app app bombardment . avoid cost . save storage , money constant notifications "
3189,real violation privacy app . 
3190,worst app ever app open camera scanning hand open subscription . ðŸ˜•do download app 
3191,"trying make video call , music loud app wo let turn volume . annoying . , one picked call . really offer feature ready . "
3192,app functionality ok . need improvements ui please add biometric authentication simplify login process . 
3193,please improve app design add biometric authentication make app easier use . biggest bank lost snaller bank . 
3194,privacy concern . app need access storage . dude ? need phone access internet access transaction . far beyond . 
3195,"best looking apps , least feels safe enough "
3196,"app downloads piece software run , requiring lower device security - badly designed software flow banking app . "
3197,ads home screen apps ? ? rude . uninstalling 
3198,privacy issue . app wants download phone data server . stay away . 
3199,"worst massenger app playstore . developers need fix lots issues app . like new users cant logging , lagging much good phone , taking time delivery photos & videos quick share whatsapp . "
3200,app poor even work keep showing privacy policy 
3201,worst app ever soo strict also lot bugs ! ! ! fix apps erase security make friendly user ! 
3202,poor apps much security built . download app wste time . . 1 messenger apps 
3203,trust app monitor everything without permission . 
3204,bad application ! ca even sign privacy policy would load signing . lost time trying make account data download app . 
3205,"privacy app . messages , including password , read government . "
3206,"gpdr compliant , privacy concerns . collected 500mb data without even login . login 3gb data weeks counting cache without anything app except 2 text messages . "
3207,app strips privacy keeps totally naked ! 
3208,"spying app , draining battery "
3209,"messaging app buggy laggy even logging massive pain . top , takes 1.3 gb fresh install understand primarily messaging app needs big . tl , dr : app looks acts like malware . "
3210,"worst app ever used , undoubtedly .. bans id without reason , got number blocked , happened right 10min installing app .. -_- mean ? even send single text , neither installed app anywhere else except google play store . "
3211,security oriented user friendly app 
3212,"security app , rest assured password compromised . "
3213,worst app ever . tried log using verification codes says suspicious registered mobile number . dont dare install app . worse useless . 
3214,"value privacy , app backup data without permissions . "
3215,"app user friendly , u ca trace back message texting histories friends chat histories changed new phone , purpose app restricting people changing phone . "
3216,dont't allow permissions necessary app doesnt work 
3217,"intrusive pop-up forces consent privacy laws , stated give information third parties . literally worse messaging app came . "
3218,privacy ðŸ” issues app 
3219,"definitely listening using app . app constantly using phone service os service using . found debugging issue . wechat dev , criminal . classified spyware . download app , value privacy . "
3220,rubbish apps ! drain battery even though open apps . many hidden tracking going ! ! ! ! ! 
3221,"display apps set allowed , disturb turned , nearly permissions turned , yet still pops apps asking phone number every minutes . extremely trash annoying app . wish give 0 stars . would use app recommend parents use reason . never upset app . know , app virus bypassing settings . "
3222,"even think installing , app worth time . constantly sends unsolicited user data background . found sensitive user data sent secretly without obvious breach tos . addition , get permissions disabled . constantly throw error toasts even using app . open without consent . "
3223,idiot app . registered got blocked . ridiculous security idiot developers . try create apps like . waste memory . 
3224,"careless update , app removed playstore "
3225,app bad . dont use . asked questionable permissions absolutely need order function . gobbles storage faster triple game titles way clear uninstalling reinstalling . major privacy conerns well . 
3226,open automatically use apps use personal information ? app stealing personal information ? 
3227,"recent update , app kept opening consent request even closed . delete felt like trying control phone "
3228,app invades privacy pops nowhere numerous times everyday really bothers especially playing game phone 
3229,registration needs authentication wechat friends . might well remove google play make apps private use 
3230,"bad app , want sign ! privacy policy , next button . "
3231,security ? making apps worst amongst . 
3232,"horrible app , auto start without permission . updated one latest version . hijacks screen every time unlock phone ! even turn permissions , still automatically start everytime . "
3233,"use app . recently , app bombarding requests sideload updates google play store , opinion , behavior crosses red line . "
3234,shady app asking users install updates unknown sources instead google playstore . 
3235,"app allow fully register , going 3 days telling suspicious registration using verification code send . service improvement needed . "
3236,"lost previous phone number could change number app , saids account could compromised . ya , compromised company . data secure . , sticked old phone number . ca login email using new phone . using sms friend message . bulky enough get phone storage occupied . apps storage shows mb , phone shows occupied gb . trying mitigate worst whatsapp fb . "
3237,"really bad app , lame programming , bad logic , constant hangs , constant security issues , constant hassles , locks account use often , says detected unusual activity account asks friend information unblock account , ca contact friends ca log , call use another app . bother app another one anyway ? switched line , works great . "
3238,horrible app . request many permissions . use huge storage phone way delete . updated 8.0.2 even ca use mini program . 
3239,"app robish , found blocking accounts stress open account "
3240,using app . fun use . even hard login old account . ridiculous . lot saying app secure authority surveillance app 
3241,"app moronic implementation 2 factor authentication ! requires new users find someone scan qr code inside wechat profile authentication new user ! ! tons authentication mechanism apps , must idiotic one ! spawned many facebook groups claim help , . users charging money scanning qr code . think app review team take close look app requirement make change . 3 days able get app verified even fb groups advertise free verification asking $ 50 dollars wechat account verification ! moronic google develop support permit app like platform risk user privacy invite fraud activation ! "
3242,getting notifications . notifications settings enabled . app allowed use background data . update app since december 2020 ? unusual . 
3243,"user beware , app acts conduit ccp propaganda , misinformation getting eyes personal data . utilising personal messaging tool voids privacy even . "
3244,"require every permission includes time file read , microohone , location , sensor information , read contact ... app full ads posts . turn permission , say migration failure ... try migrate phone ? chat uses animate emoji nudge people plus .. app "
3245,worst messaging app ..... past everything fine friendly instant messaging app ..... verification process totally stupid .... want make app connects globally stop nonsense 
3246,"stuck privacy guidelines screen sign-up . 'd expect app popular responsive , total garbage . "
3247,"useful tool , works advertised , massive security issues . use unless forced . actively monitors sensors private chats . video , audio , typed messages , purchase , location data collected analyzed . "
3248,enjoyable using app . menu options difficult work privacy policies unnecessarily rigid . 
3249,"installed app , started go puzzel like security authentication , wasted half hour stupid puzzel like security authentication , never ending , trust . got app uninstalled . end . gone back messanger . ðŸ˜ðŸ˜ðŸ˜ "
3250,"stupid app start creating account . way new user use app . spyware . need activate simcard , 'll never use app . "
3251,.. app removed playstore .. anable log .. remove period .. 
3252,poorly designed app waste time security verification without successful ... please improve app . thanks 
3253,"ridiculously abusive permissions ( camera , contacts , location , microphone , phone , body sensors , storage , virtually every android permission sun ) . gets location background . otherwise good . "
3254,read alot app mixed feelings . like gov'mnt contol app . privacy also issue 
3255,app system also disappointed login password new account creat critical 
3256,"apps many problem .. accidently uninstall apps , install login id "
3257,expect privacy security using app . 
3258,app surveillance everyone 
3259,rogue app asking first born . extremely intrusive including body censors . notification get migrate phone data storage keeps coming back turned phone . 
3260,"never download app : many operations please try later . friend verification qr code phone number . conclusion : basically , horrible messaging app . update : even use friend verification , still stucks security verification . 'd rate 0 % horrible app . "
3261,useless apps .. log old account security verification 
3262,app mess . getting useless time . much restrictions require many useless information process login sign ! whatsapp facebook messenger best alternative 
3263,"app eats device storage space . shared pictures/videos/chat history stored device . previously could remove large files manually since placed external storage , seems moved internal app . aside lack fine-grain storage control , otherwise good thing . "
3264,installed got stuck verification . 200mb chat app . interface terrible . bulk app full backdoor spying . resource hog . 
3265,horrible bad application ever . stay without using blocked lost contacts etc . app dictatorial spy . 
3266,"compromises device security ! app provides conduit targeted surveillance ministry public security . ever visit china app installed , expect government use built back doors stalk steal information device idea could access app . us government could step , , stop using app . better yet , remove . "
3267,"forcing users provide location otherwise application work finally app going go , goodbye , please want see . "
3268,app steals personal info . install 
3269,worst app ever first download told delete whats app messages app messages logged incorrected password tried still used another method send verification coad still didnt logged tried twice logged kicked .. disappointing .. 
3270,"app bad , privacy serious problem . there.are many auto starts background access location info . also many ads . "
3271,"deleted app fast could . difficult logins , useless app "
3272,hey google .. please remove app playstore .. application useless . taking user data . 
3273,"getting worst , kind security ? one would able use app . trash application . "
3274,worst application ever seen .... sign ... required scan code friends help .... try facebook ... phone still required . ? ? ? spying ? ? ? f & # $ k app ban play store 
3275,content manipulated . storage permission required saving photos android 10 . lie . 
3276,give apps .. blocked reason ... customer service useless ... 
3277,"first app good . used app many months account blocked . says violations harassment , malicious marketing , fraud . even though three things . frustrating . asked send message particular number says `` unable receive sms verification code `` hope could fix problem . "
3278,please uninstall apps ... apps goodðŸ‘Ž 
3279,actually really like app . clean interface . functional powerful . seriously considering private information could breached . 
3280,"simple . phone number blocked , even though install want use app first time . register . uninstalled . "
3281,app totally stupid.too much security hate app 
3282,threat data security ! ! stay away app ! ! 
3283,fraud app . gathers sensitive information tracks location 24x7 . stay away 
3284,"worst app , suspected hacking . zero privacy . video call never works . "
3285,information stealing app disguised messaging app 
3286,app propoganda steal users data blackmail users different different email id 
3287,"secure , asks unnecessary permission steals data . "
3288,"app blocks profiles without notice . also blocked without offense.this app third class software . truth . never create account . created , never put money . app blocked . said twice downloaded app phone times accused harassment money stolen justice done . "
3289,useless app . spy users data .. 
3290,"one worst social apps ever , even unknown social app better qualities . account `` protected `` state absolutely way retrieving back . friend account linked facebook . think twice using app ! ! ! "
3291,verification login account another device sick ca use method offered lost account forever data old exist im link apps verify please change login method im one problem . 
3292,"poor app , app stucked phone several times opening & guarantee privacy . "
3293,apps need removed play store 
3294,"trash apps ! ! useless apps ! ! blocking ro reason ! need another users verification ! place trash apps trash , play store ! "
3295,privacy issue password encrypted . use app . tool scam china put citizen surveillance . beware 
3296,"know go , leave . app secretly backs data phone idling . privacy issue . ca delete app business connections etc . screenshots backup claims . "
3297,terrible app . concern user privacy . 
3298,app user friendly . uses private information . uninstalling 
3299,app use personal data without permission harmful app users special danger indians users 
3300,bad app eating 1gb memory making mobile slow ... deleted dont trust app owner privacy security . 
3301,unsecure app 
3302,"could register app , without putting another registered user complicated process . unable register app , making useless ! ! ! reason , also 10 times bigger communication apps , protect privacy . ? "
3303,"app irritating ðŸ˜¡ & non user friendly . end-to-end encryption , though expected . please provide security , otherwise one use . "
3304,app good . expose privacy . uninstall app soon possible . 
3305,app steals data kind spy us . 
3306,wrost application delete play store 
3307,security verification ridiculous . stupid developer . dont use email one time password purpose ? annoying app . 
3308,pathetic way security verification procedure made delete app . never seen anything like chatting apps . 
3309,issue privacy . think application collect personal data misuse . never recommend anyone 
3310,security feature worst every app need another account confirm account condition applied - one using chat area wanted 
3311,think secure app soon installed getting app registration code sms looks suspicious . installed app 
3312,useless app collect data us one day block account giving false reason . scamming . deleted app 
3313,app login global users hate app policies want freedom 
3314,worst app ever soo many issues ca even able login using phone number asking verification friends . ca even able login using mobile number otp . better download app friends . 
3315,play store remove app work login 
3316,app asks much private information scan code phone ? ! ? ! ? ! ? ! ? ! app worst dont download horrible 
3317,avoid app every way ! terrible app worst privacy protection level speach freedom ! also requires way many permissions ! also high possibility device hacked monitored even usage data stolen ! ! ! ðŸ˜±ðŸ˜¡ðŸ‘¿ 
3318,app bullsh ! must removed playstore 
