,Review
5073,"spyware ? app asks location , access files , access camera want change color light . reason wo even connect bluetooth unless enable location data . like hell ? bluetooth , need gps . anyways , seems invasive popular company expect kind bullcral "
5074,"app reset login longer recognized , company code , user password wo recognize . "
5075,farud application .... trust .. app take personal information hack thr accounts .. 
5076,"installed , logged in- white screen , uninstall . useless app . edit binance response : wanted install app could delete account opened minutes ago . delete account banance forces users provide data nothing verify device brand model , basically collecting user data . illegal . would surprised thousands open inactive accounts binance users decided bother deleting . avoid "
5077,app secure povide high security function settings app save money save prsonal data etc . 
5078,"useless app wo let autofill login information , prevents press-hold popup login text fields . makes using password managers difficult "
5079,"app good overall really annoying bug : time time , whitout even opening , starts showing authentication screen top every application even locked , making hard unlock phone , stop force stop app details "
5080,"feeling frustrated . able log app , minimize app get email verification code filled information erased . think mobile friendly app . "
5081,"app constantly opens , even without permissions , point option becomes uninstalling "
5082,"great app use crypto investment giving 3 star fix annoying pop bug ... everytime account get logged automatically ( binance security reasons ) biometric authentication pops , even using apps frustrating . please kindly look , thank . â¤ï¸ "
5083,"invasive , forces us log every app . interupts every activity . "
5084,one year half since reviewed app fingerprint authentication still broken . 
5085,"app user friendly , work least . recommend caution using company strange security policies may decide lock account make difficult reactivate . ideal want personal control crypto . "
5086,"absolutely terrible app , lags , stalls , system busy try later messages apparently incorrect password , basic errors app design . considering market leaders field app appalling . "
5087,"worst app , also problem . specialy number verification google authenticated call verification .never download "
5088,"useless user friendly app .. keep security thing , forgot binance password well email id password kyc guys check get log account "
5089,"created account able verify later , wanted log password know well wrong , understand whole problem password . created another account , verification problem trouble ? app becoming nuisance "
5090,want app demands verification phone email every time use app ... trust better apps ! wo name since review note app 1/5 simply verification system every time want send login .. make sure pc phone ready every time login . 
5091,really intolerable bug . time app overriding whatever phone requesting fingerprint verification . outrageous deal breaker thinking keeping service . 
5092,"worst app ever used . configuration frustrating . final stage verification , ca capture facial verification . went back start afresh , till date could login . boss advise uninstalled reinstalled register new email second number , . verify email account . till date number ca verified . number receiving code . binance voice sms available always service/error . something pls "
5093,apps market way convinient user friendly interface 
5094,app opens randomly asks authentication dont't even want use 
5095,"app log weekly basis . even want use anymore , spent way much time 2fa , pasting password , etc . even worked 1password , ( used work past ) . update ? logged . 2 days without open ? logged . stupid . "
5096,"shitiest app ever . able verify top also allowing convert assets binance . guys personal phone number also gmail , top use google authentication log every time . whenever try contact customer service transfer one person help , one able help bcoz lost lot money invested . "
5097,useless app insurance payment fraud app give services close app 
5098,"worst app , allowing register `` security restrictions `` provided information requested ! ! ! ! ! "
5099,"good app . document verification , small mistake ( blur etc ) verification rejected . users , thief/robbers sadly binance treats us like . uninstalling app . better use delta exchange app . binance even 1 star . without giving one star , review submitted . @ google , please think zero star rating , binance one app immediate front give zero rating . "
5100,"app less 24 hrs already trouble login . keeps saying new device . ? ca login . based paired reviews , would recommend app "
5101,"app far total sh * * te . designed poorly performing mess ? need double 2fa every time someone logs ? allow identity verification website computer site distinguish front back cameras phone , laptop camera photograph id . whole `` verify withing 5 days `` nonsense . 5 days ? unbelievable . "
5102,"app ok . super annoying log everytime phone email confirmation . ways keep secure access , existing app "
5103,app getting personal infos logging whithout concent try log say wrong password . heck ! 
5104,"awful app , tried logging 1 week .. type code numbers enter logging ! type numbers ! app ! login page ! already tried week . uninstalled , cleared cookies etc . still useless ! login ! "
5105,app getting worse worse . dump dump forbid password managers . looking another exchange 
5106,app wasted 24 hours multiple submitted videos personal invasive facial recognition every time try logging makes reset password entering password every time . went dozen people ca fix errors say one verified one non verified account one email one phone number make jump hoops fix . would never recommend app got nothing fix spent 24 hours issue step 
5107,error business account login screen . app wont allow normal individual account login . forces business account login . bug 
5108,everytime get app copy 2 factor authentication code app takes back login page . chance logging back logged automatically . camera app verification dark faulty never get verification done dodgy third party useless camera use app . app full bugs . useless app ! 
5109,"keep say permission access service , wrong app , kindly look fixed , makes app disgusting . "
5110,"honestly app good days , app disappointing . days , unable login account . whenever tried show `` sorry permission service `` upsetting . please developers something good urgently ... "
5111,problems authentication system deal intelligently stop asking users login everytime open app . whilst others smart using biometric pin codes expiring token .. smhðŸ¤¦â€â™‚ï¸ 
5112,"dont understand apps adays want access , tell dont permission access service "
5113,"well , deleted review . reposting - hate app cause keeps requiring 2-step authentication every single app update , lot . edit : problem logging , normal , requiring 2-step every login . able remember device . "
5114,"app worst verification system . first , ca even upload photo one gallery albums . second , take picture document redirect back start . frustrating . "
5115,trustable ... putting correct credentials app allowing access .. wrong id n password times open id n password . 
5116,"complained lot , still nothing done , app would tell dont permission access service , could like hours , finally open account , idea . "
5117,"fingerprint security function work last update , required use password mobile code every time open app . "
5118,"verification forced install app , security threat additional intrusion privacy "
5119,"account keeps auto logging every week ! annoying , please fix . security measure , give user option disable . already 2 factor authentication fingerprint opening app ! "
5120,useless app . identity verification hard verify ? recommend app friends . 
5121,"latest update bad , enter username password every days makes app unfriendly . banking app require , piece junk . "
5122,bad app identification documents submitted every time app problemsssss ..... bad system ... 
5123,investor main thing want see p+l . worst app ever used monitoring . needs serious changes made bring par user friendliness apps . 
5124,"pointless app , need login every days , use website . fingerprint 2fa every day ... useless "
5125,app bad ever want access app view charts keep saying `` permission `` seen complain reviews solutions app useless google play store drop 
5126,"authentication processes nightmare 1 hr life lost , deleted app waste time "
5127,app nonsense full bugs even access account error messages keep showing 'you permission access service worst app ever seen 
5128,"app lot issues since last update . able log reset password , emails text messages received . ca never speak agent , busy app gets blocked . "
5129,app showing permission access service ever since updated 
5130,"update making app open , says permissions access service .. going "
5131,"good app , forced sign driving nuts . app wo remember pass login information . ca remember everything , usually rely google password manager . work app , app support fingerprint access . "
5132,"app always tell permission login , fed "
5133,"app maintain session active log manually . use pc stole easily money without knowing username , password , 2fa code ... app close session automatically . billions company manage security money . great ðŸ‘ðŸ¼ "
5134,updating app became worst permission access service 
5135,"app forgets login credentials time time , even though additional sign-in features enabled ( like biometric fingerprint etc . ) . "
5136,login details forgotten constantly need associate account app also requires set security . really insecure app manage funds 
5137,app accept first google 6 digit code 2fa verification ? ! pathetically bad programming ! 
5138,"randomly disables fingerprint login gives message `` network request failed `` trying methods . contacting support , ask screenshot issue , helpfully block users taking app . getting sick bs . "
5139,20 factor authentication ridiculous . email app phone app email app . set mail app . trash . 
5140,useless app ! allowed login account candid reason ! 
5141,"installing , hid app phone . months later , decided take hidden apps sudden uninstalled . app wo let reinstall . please fix . "
5142,"app steal money ! invested money app told cleared verification , account holder account closed money paid able returned . app effectively stolen investment , would put anyone using app platform invest crypto currency . use trust worthy sight coinbase instead . "
5143,app ridiculous notion login authentication needs done via email sms text phone registered account logged . ridiculous inefficient . binance really trusted ? 
5144,"disallows use device take screenshot registration hide incompetence requiring number password saying need number . also bad faith operation prevents troubleshooting issues . even though app , registration acts website ! us version app ? , referring web page ? issues inspire confidence . "
5145,install application . worst app .. trying verify personal details since month accepting wo reaply queries . please waste time energy . 
5146,app user friendly . 2fa worst ever encountered . 
5147,worried security application request passwork launching app . read news binance hacked . 
5148,totally useless app 24 days still identy verification pending uninstalling use trust wallet great app ! 
5149,"app issues fingerprint authentication : enable fingerprint launch app , press back fingerprint required app logs , better try mistake . , log enable fingerprint . "
5150,"absolutely abysmal design , verify account less 25 times via email phone need authorize new device , using device using sign , account disabled risk amount attempts . uninstalled use another app . "
5151,"high security risk app . someone runs past grab phone open , steal crypto . thieves .hackers /thieves access email sms google authentication steal everything sim swap open phone . binance needs fingerprint biometric login . "
5152,"apparently anything receive token payments app requires give extraordinary amount personal information including copies photo id , social security number tax records . â€™ absolute fool send kind information internet website brick mortar office . even banks â€™ require level invasion privacy . fact , point bitcoin protect privacy would even think giving much information app ? massive invitation leak dangerously sensitive data . absolutely even consider using app . "
5153,â€™ access account . due continuous ssl errors . absolutely worthless app ! ! ! 
5154,"try sneak crazy new permission called extra location tools ! youre silly ... crypto app ? anyone allowing owning crypto probably soon wont . horrible also crashes samsung devices uploading ur priv data background ! fail ! shame ! bad bad bad ! sensitive app log data permission app , umm , thanks .. screenshotting sharing pub archives dissenter cersion page case censorship ! superfail ! fail "
5155,"app need setup biometric security every update ? poor handle mobile anytime would want snooping around trading apps without permission , please fix . great job guys ... ðŸ‘ "
5156,financial transaction app transaction log .... really ? user friendly seeing exact information regarding account . 
5157,"app requires access ur camera , media files , entire storage device permission modify whatever want .. breach privacy "
5158,"handle apps bugs . handle apps charge use . even tolerate apps crash . tolerate apps beyond difficult use even without issues blame . known something wanted verify security measure website app time , follow instructions presented still work support faq tell need download yet another app . time pull plug . "
5159,google authentication done ask download app go app authentication said use pc poor authentication without authentication ca anything 
5160,"app potential , permissions huge red flag . permission modify system settings ? way ! sure deny permissions must use app . "
5161,"app locks usb debugging enabled , supposedly security reasons . obvious nonsense since app , including security banking apps , requirement . best , means app underdeveloped run common security setting . obviously disabling debugging one app , uninstalling . "
5162,loved app latest update . worked fine first days wo even open . get `` application violated security policies shut `` message every time android phone . tried putting 3 phones thing . pretty frustrating . bank says app must phone needs updated service provider problem . phones updated . cricket says . gives ? 
5163,app related website intrusive . allow search unless able pinpoint exact location . 
5164,"`` ip webcam `` best , using since 6 years , app data location big risk , app asks control device storage change system settings ? u n n l l n g immediately . "
5165,app remove phone ðŸ˜ž application big threat security 
5166,"install program , must take away permissions app page settings . camera use , microphone use notifications permission whatsoever ! uninstall ! apps like anywhere internet designed hijack equipment ! "
5167,worst app dont download . share personal information third party 
5168,app bad little bit possitive much level impact privacy ban app 
5169,warning ! app suspiciously overpermissioned . possible data mining spyware . developer needs explain need/use privacy sensitive permissions . 
5170,galaxy s5 : motion detection scheduled recording disabled ! need add lock screen option screen and/or able run background accessing apps 
5171,happens top different apps reason . uninstalled . worst way give ads . google remove app permissions . 
5172,"happily left 5 star finally giving us options turn excessive features , introduced app lock disabled . hell wrong product manager ? insisting going road spamware approach , fine . see many people asking good alternative app reddit forums . please believe good replacement sooner later . meanwhile , blocking internet access app cus trust issue . "
5173,force users update apps without downloading play store 
5174,"ask many permissions access phone.say , deny access phone location , pop request asking grant . annoying . outdated user interface design stutter animations . worse , user interface disguise many tricks prioritize service want promote necessarily helpful users . service come cost premium . extra careful opt-out `` premium `` service offer . "
5175,app asks kind sensitive data phone . feel safe personal information . deleted . è¿™åº”ç”¨è¦æ±‚å¾ˆå¤šæ•æ„Ÿèµ„æ–™ï¼Œä¸ªäººèµ„æ–™æ¯«æ— ä¿éšœï¼Œåˆ æŽ‰äº†ã€‚ 
5176,"app asks permissions control camera , access contacts , answer phone , access files , every time opened . want app collects fitness data watch shows . "
5177,"easy bypass anti-root measures , turn permissions access apps . deleted last review purposefully anti-root . "
5178,"used favorite app 2019 usually hid photos videos private album access ever want since january 2020 able access stuffs really annoying , time try sign , instructions enter device password put phone email , put phone email , response `` account already exists device , please need guys fix really need stuffs back . "
5179,idiots need permission go contacts files .. think bit dubious app . dont allow app get ur contacts files 
5180,"app ran without permission , ignoring attempts block . still care privacy , deleted . people really question app take control camera . "
5181,app tried delete photos camera could even start using . deleted right away . response required ! 
5182,"app takes entire phone . constantly pulling ads notification every time someone calls texts . save personal information , install . "
5183,app take phone ... even deny certain permissions . annoying ! 
5184,"zero reason ask many permissions phone . app guaranteed nonsense . install risk . dev , bother telling app safe . know trust strangers . remove needless permissions get back us . "
5185,app interface pleasant see photo features . biggest problem requires awful lots permissions . require read contacts ? require use sms ? require reroute going calls ? understand needs access phone storage wonder workarounds phone security without phone asking permission first ? app looks suspicious . lot ads . 
5186,app needs much set permission smart phone . people want collect private data . ? ? ? ? installing app compromise privacy . 
5187,app need permission phone . photo app call bluetooth wifi permission tons permission app need seems required function photos 
5188,"app managed get apps . got text messages sweet camera notified well . calls , facebook notifications . access many personal information . uninstall ! ! "
5189,"photo app keeps giving notifications device maintenance device heating acting like virus scanner . extremely extremely dodgy ! told app stop giving notifications , phone setting turned notifications app , gone app turned notifications . still pushing extremely dodgy app . uninstall recommend "
5190,"app invasive , puts pop ads phone even using app . pissed much , even get bother trying camera features . avoid . "
5191,"ok , turning auto sync , annoying . would never like app change system settings . needs whole ton permissions ? ? ? apps fine storage camera permissions ? worth risk uninstalling ... "
5192,"camera app portion nice wants permissions contacts , sms , phone location pop ups phonecalls showing phone number called ... camera app tracking device ? "
5193,app taken phone . pop ups even app forced closed . 
5194,"app appear malware , permissions requires dangerous . basically give full control phone install , ca turn excessive permissions . able view connect nearby bluetooth devices , control sync , gather account info , mine contacts , etc . worst one fact place direct calls reroute outbound calls , let turn . revoked access phone calls , turned right back . definitely kind shady spyware . install . "
5195,camera nice app generally easy use . fact anytime unlocked phone ad would pop-up killed . limited permissions storage camera still ads populate . out-of-app ads appalling . uninstalled immediately . 
5196,"shame , enjoyed using app , junk started showing - telling junk files phone & asking ram-boost . trace back app . art/photo app , really want intrusion & deleted app immediately . "
5197,like app features intrusive . caller id pictures ? tried turn feature keeps coming back . need yet something else intrudes privacy . 
5198,"app filled phone weird adds , developers think acceptable beyond , app 4.7 5 stars incredible , putting bunch bloatware ? surprised , uninstalled . "
5199,warning beware app causes ad pop every phone call get yet app nothing calls makes creepy . definatly invasion privacy going nosey camera app 
5200,app took lock screen 2 steps open phone instead 1 . loved filter app comes much ad baggage ! 
5201,nice application worst also due lots adds disturbance unlocking phone ... deleting app 
5202,hated app kept running background option shut . trust apps ca shut every time phone call charged phone opened trying get use apps 
5203,"latest update require access photos , camera , location , etc. ? want access account , give personal information . deleting app phone . 'll use web browser instead . "
5204,"app used great , 'd enter password go account need . since last update longer sign keep getting locked app . spoken customer service unlocked . useless . please fix re-rate . "
5205,showing users location without getting permission . google ban app . 
5206,app save privacy . 
5207,"update : app still drains battery secretly . also , ios version allows users stop checking messages background , android version option . auto-restarts several minutes force stop , keeps consuming battery life background . way stop running secretly . everyone uninstall app . without , phone â€™ battery life way longer . "
5208,app automatically downloads apps without permission users . request google take actions . è¯¥è½¯ä»¶æœªç»ç”¨æˆ·å…è®¸æ“…è‡ªä¸‹è½½ â€œ å¾®åšæ–°é—» â€ 
5209,"understand app needs access phone , trying steal phone log ? "
5210,"understand hell app like needs access phome , sms , microphone , calendar contact . besides , keeps automatically running background even process manually terminated notifications shutted side app . know malware defined , one . suggest everyone stay away one play store never let app like listed . "
5211,pure social networking app . keep asking permission make phone calls ? even open app deny rude request . 
5212,"intrusive , collecting way much data need publish privacy without permission . yeah , know give permission access information install app . publishing ! uninstall ! "
5213,"android sina weibo spyware ? every new version requesting new permissions easily abused , reading contacts accessing system private log . behavior separate facility update outside app store us also scary . given close ties company chinese security apparatus , uninstalling android application ... "
5214,"å¼€æœºè‡ªå¯ï¼Œéš”æ®µæ—¶é—´è‡ªå¯ï¼Œç´¢è¦å„ç§æƒé™ã€‚ä¸çŸ¥é“ä¸€ä¸ªç½‘ç»œç¤¾åŒºçš„å®¢æˆ·ç«¯å¹²è¿™ç§äº‹æƒ…æƒ³å¹²å˜›ï¼Ÿæµæ°“å…¬å¸å¼€å‘çš„æµæ°“è½¯ä»¶ï¼ start system , auto start periodically , ask kinds permissions . justify social network client . yet another malware rouge company ! "
5215,"* * stay away app ! * * app asks permission record audio & permission make phone calls , denied , tried test editing features asked permission collect phone imei number , immediately closed app uninstalled . suspicious . "
5216,"app needs collect far much personal info , accept terms use app ! , warned ! ... wants permission `` manage `` phone calls . ! ! ? ? uninstalled immediately , agreeing nothing ! "
5217,app perfect since recently new policy uploading id gaining access chatting features ... disappointing unfair . see use app anymore since one sided ... uninstall mine . 
5218,zero privacy .. app selling data 
5219,doubt app protecting privacy . want monitor battery life & already asks unreasonable privacy permissions ðŸ˜’ chill 
5220,"failure : app unnecessarily shares detailed personal information third parties . ( firebase , appsflyer etc . ) uninstaled "
5221,app unnecessarily requires give privacy . even see display . 
5222,"deleted app due changes privacy policy allows app get load data sell third parties . , consent . business model option harm good , least humanity prioritises profit wellbeing . "
5223,app need phone storage permissions ( feels like something shady ðŸ‘ï¸ ) 
5224,"update , greeted screen told continue using app , agree collecting info phone sending business partners . deleted instead . "
5225,good battery use date app suffers mysterious ( annoying ) bug forces reset accessibility time . 
5226,"good app basically , reveals many apps keep starting w/o consent time . however , bloody liberty taker , obtrusive permission hounding . ergo useless unless one gives complete control , would tapping every interaction applications . bordering spyware imho . "
5227,"spy app see everything see interact apps friends ! sell data main apps kill new competitors help know like new apps copy features kill competition new apps ! like facebook/instagram copies new great features snapchat fast app similar spy apps ( onavo , facebook subsidiary ) . talking private pics videos allow kapersky see ! ðŸ˜ ðŸ˜  "
